{
  "$schema": "https://json-schema.org/draft/2020-12/schema",
  "type": "array",
  "items": {
    "type": "object",
    "required": ["id", "version", "name", "provider", "languages", "quality", "latency", "license", "sourceUrl"],
    "properties": {
      "id": {"type": "string", "pattern": "^[a-z0-9][a-z0-9._-]{1,63}$"},
      "version": {"type": "string", "minLength": 1},
      "name": {"type": "string", "minLength": 1},
      "provider": {"type": "string", "minLength": 1},
      "languages": {"type": "array", "items": {"type": "string"}, "minItems": 1},
      "quality": {"enum": ["DEVICE", "NATURAL", "STUDIO"]},
      "latency": {"enum": ["INSTANT", "FAST", "BATCH"]},
      "sizeBytes": {"type": "integer", "minimum": 0},
      "downloadUrl": {"type": "string", "pattern": "^https://"},
      "sha256": {"type": "string", "pattern": "^[a-fA-F0-9]{64}$"},
      "license": {"type": "string", "minLength": 1},
      "sourceUrl": {"type": "string", "pattern": "^https://"},
      "packageFormat": {"type": "string"},
      "runtime": {"enum": ["ANDROID_TTS", "SHERPA_KOKORO", "SHERPA_ONNX"]},
      "requiredFiles": {"type": "array", "items": {"type": "string"}},
      "capabilities": {"type": "array", "items": {"type": "string"}},
      "premium": {"type": "boolean"}
    },
    "allOf": [{"if": {"required": ["downloadUrl"]}, "then": {"required": ["sha256", "sizeBytes"]}}]
  }
}
